original_text,paraphrase_text,category,similarity_score,original_quality,paraphrase_quality,original_token_count,paraphrase_token_count,word_changes_count,substitutions_count,additions_count,deletions_count,is_valid,source
"terlebih lagi, mr. o neill mengatakan bahwa dia berharap hyundai akan menjual satu juta kendaraan setiap tahun di amerika serikat pada tahun 2010.","itu bukan semua: pada 2010, mr. o neill mengatakan, dia berharap hyundai akan menjual 1 juta kendaraan setiap tahun di amerika serikat.",balanced,0.6896551724137931,"{'quality_score': 100, 'issues': [], 'word_count': 23, 'unique_word_ratio': 0.9565217391304348}","{'quality_score': 100, 'issues': [], 'word_count': 22, 'unique_word_ratio': 1.0}",32,32,4,3,0,1,True,paraphrase_detection
"saham roslyn naik 82 sen menjadi ditutup pada 20,79 kemarin di nasdaq trading.","dalam transaksi baru -baru ini, saham roslyn naik 40 sen, atau 1,9 persen, menjadi 21,25.",creative,0.25,"{'quality_score': 100, 'issues': [], 'word_count': 13, 'unique_word_ratio': 1.0}","{'quality_score': 100, 'issues': [], 'word_count': 15, 'unique_word_ratio': 1.0}",23,25,5,3,2,0,True,paraphrase_detection
"ini adalah kasus tentang seorang wanita yang selama 20 tahun mendedikasikan hidupnya untuk negara ini, ""kata janet levine.","""kasus ini adalah tentang seorang wanita yang selama lebih dari 20 tahun mendedikasikan dirinya untuk negara ini,"" kata levine.",balanced,0.782608695652174,"{'quality_score': 100, 'issues': [], 'word_count': 18, 'unique_word_ratio': 1.0}","{'quality_score': 100, 'issues': [], 'word_count': 19, 'unique_word_ratio': 1.0}",25,26,5,1,2,2,True,paraphrase_detection
"kanada tetangga baru saja memutuskan untuk melegalkan pernikahan sesama jenis, dan mereka memiliki harapan besar bahwa mahkamah agung massachusetts akan segera mengambil langkah serupa.","kanada baru saja memutuskan untuk melegalkan pernikahan sesama jenis, dan mereka memiliki harapan tinggi bahwa pengadilan tinggi massachusetts akan mengambil langkah serupa dalam beberapa minggu.",balanced,0.6774193548387096,"{'quality_score': 100, 'issues': [], 'word_count': 24, 'unique_word_ratio': 1.0}","{'quality_score': 100, 'issues': [], 'word_count': 25, 'unique_word_ratio': 0.96}",34,35,5,2,1,2,True,paraphrase_detection
"meskipun demikian, ekonomi ""belum menunjukkan pertumbuhan berkelanjutan.""",tetapi ekonomi belum menunjukkan tanda -tanda pertumbuhan berkelanjutan.,creative,0.46153846153846156,"{'quality_score': 100, 'issues': [], 'word_count': 7, 'unique_word_ratio': 1.0}","{'quality_score': 100, 'issues': [], 'word_count': 8, 'unique_word_ratio': 1.0}",12,11,4,1,1,2,True,paraphrase_detection
"sensor cahaya yang istimewa dan sensitif mengambil cahaya, katanya.",detektor cahaya yang sensitif kemudian mencari cahaya biru.,creative,0.2857142857142857,"{'quality_score': 100, 'issues': [], 'word_count': 9, 'unique_word_ratio': 1.0}","{'quality_score': 100, 'issues': [], 'word_count': 8, 'unique_word_ratio': 0.875}",12,10,4,3,0,1,True,paraphrase_detection
"subjek selanjutnya diberi semprotan di hidung rhinovirus, kuman kecil jahat yang menyebabkan pilek.","setelah penilaian mereka, setiap sukarelawan menerima semprotan di hidung rhinovirus, kuman yang menyebabkan pilek.",creative,0.47619047619047616,"{'quality_score': 100, 'issues': [], 'word_count': 13, 'unique_word_ratio': 1.0}","{'quality_score': 100, 'issues': [], 'word_count': 14, 'unique_word_ratio': 1.0}",22,24,2,1,0,1,True,paraphrase_detection
celf mengatakan ibm mengejar keanggotaan dan berencana untuk menjadi peserta aktif di forum.,"ibm mengejar keanggotaan dan berencana untuk menjadi peserta aktif di celf, menurut berbagai anggota celf.",balanced,0.6666666666666666,"{'quality_score': 100, 'issues': [], 'word_count': 13, 'unique_word_ratio': 1.0}","{'quality_score': 100, 'issues': [], 'word_count': 15, 'unique_word_ratio': 1.0}",17,21,2,1,0,1,True,paraphrase_detection
"orang indonesia kedua, imam samudra, yang disebut ""komandan lapangan"" dari pemboman, dijatuhi hukuman mati bulan lalu.","imam samudra, pemimpin tim yang melakukan pemboman, dijatuhi hukuman mati bulan lalu.",creative,0.5,"{'quality_score': 100, 'issues': [], 'word_count': 16, 'unique_word_ratio': 1.0}","{'quality_score': 100, 'issues': [], 'word_count': 12, 'unique_word_ratio': 1.0}",25,18,3,1,1,1,True,paraphrase_detection
"indeks 500 standard poor kehilangan 6,77, atau 0,7 persen, menjadi 927,62 pada pukul 10:33 pagi di new york.","indeks 500 standard poor s standard .spx melepaskan 0,17 poin, atau hanya 0,02 persen, menjadi 934.",creative,0.30303030303030304,"{'quality_score': 100, 'issues': [], 'word_count': 18, 'unique_word_ratio': 1.0}","{'quality_score': 100, 'issues': [], 'word_count': 16, 'unique_word_ratio': 0.9375}",32,28,5,4,1,0,True,paraphrase_detection
hampir 6.000 pengemudi mta dan operator kereta bergabung dengan mekanik di garis piket.,hampir 6.000 pengemudi mta dan operator melatih kemudian keluar dari pekerjaan dalam solidaritas.,creative,0.36363636363636365,"{'quality_score': 100, 'issues': [], 'word_count': 13, 'unique_word_ratio': 1.0}","{'quality_score': 100, 'issues': [], 'word_count': 13, 'unique_word_ratio': 1.0}",19,18,1,1,0,0,True,paraphrase_detection
"taher, yang bertindak melawan saran pengacaranya, menjadi anggota kelima dari kelompok enam orang yaman-amerika yang memasuki perjanjian pembelaan dengan pemerintah dalam kasus ini.","taher, yang bertindak melawan saran pengacaranya, menjadi anggota kelima dari enam yang memasuki perjanjian pembelaan dengan pemerintah.",balanced,0.6923076923076923,"{'quality_score': 100, 'issues': [], 'word_count': 23, 'unique_word_ratio': 0.9565217391304348}","{'quality_score': 100, 'issues': [], 'word_count': 17, 'unique_word_ratio': 0.9411764705882353}",34,23,3,0,0,3,True,paraphrase_detection
"el watan, sebuah surat kabar aljazair, melaporkan bahwa para penculik itu dengan keras menolak serangan angkatan darat pagi ini, menembakkan senapan kalashnikov.","el watan, sebuah surat kabar aljazair, melaporkan bahwa para penculik melakukan perlawanan sengit selama serangan angkatan darat, menembakkan senapan kalashnikov.",balanced,0.6428571428571429,"{'quality_score': 100, 'issues': [], 'word_count': 22, 'unique_word_ratio': 1.0}","{'quality_score': 100, 'issues': [], 'word_count': 20, 'unique_word_ratio': 1.0}",33,31,2,1,0,1,True,paraphrase_detection
"sementara persediaan aspirin sebulan dapat berharga kurang dari 10, jumlah ticlopidine yang setara dapat berjalan secara signifikan lebih dari 100.","sementara persediaan aspirin sebulan dapat berharga di bawah 10, jumlah ticlopidine yang setara dapat berjalan lebih dari 100.",balanced,0.7727272727272727,"{'quality_score': 100, 'issues': [], 'word_count': 20, 'unique_word_ratio': 0.9}","{'quality_score': 100, 'issues': [], 'word_count': 18, 'unique_word_ratio': 0.9444444444444444}",29,27,2,1,0,1,True,paraphrase_detection
"penumpang akan diberikan pengembalian dana dan voucher untuk perjalanan lain, katanya.",penumpang di kapal pesiar itu harus diberikan pengembalian dana dan voucher untuk perjalanan lain.,creative,0.5555555555555556,"{'quality_score': 100, 'issues': [], 'word_count': 11, 'unique_word_ratio': 1.0}","{'quality_score': 100, 'issues': [], 'word_count': 14, 'unique_word_ratio': 1.0}",17,19,2,1,0,1,True,paraphrase_detection
"seorang anggota kolektif chart-topping begitu kru yang solid membuang pistol yang dimuat di gang ketika ia melarikan diri dari polisi, sebuah pengadilan mendengar kemarin.","seorang anggota kelompok rap begitu kru yang solid membuang senjata yang dimuat selama pengejaran polisi, pengadilan southwark crown diberitahu kemarin.",creative,0.37142857142857144,"{'quality_score': 100, 'issues': [], 'word_count': 24, 'unique_word_ratio': 0.9583333333333334}","{'quality_score': 100, 'issues': [], 'word_count': 20, 'unique_word_ratio': 0.95}",31,28,5,4,0,1,True,paraphrase_detection
setiap hari lebih banyak tentara amerika meninggal.,kami kehilangan satu atau dua tentara amerika setiap hari.,creative,0.38461538461538464,"{'quality_score': 100, 'issues': [], 'word_count': 7, 'unique_word_ratio': 1.0}","{'quality_score': 100, 'issues': [], 'word_count': 9, 'unique_word_ratio': 1.0}",9,11,2,0,1,1,True,paraphrase_detection
perwakilan trillian tidak mengembalikan komentar yang meminta email.,perwakilan tidak membalas panggilan yang mencari komentar tambahan.,creative,0.38461538461538464,"{'quality_score': 100, 'issues': [], 'word_count': 8, 'unique_word_ratio': 1.0}","{'quality_score': 100, 'issues': [], 'word_count': 8, 'unique_word_ratio': 1.0}",12,10,3,2,0,1,True,paraphrase_detection
"saham iac ditutup kemarin turun 2,81, atau 7,6 persen, pada 34,19.","saham interactivecorp ditutup pada 34,19, turun 2,81, atau 7,6 persen di pasar saham nasdaq.",balanced,0.7,"{'quality_score': 100, 'issues': [], 'word_count': 11, 'unique_word_ratio': 1.0}","{'quality_score': 100, 'issues': [], 'word_count': 14, 'unique_word_ratio': 0.9285714285714286}",22,29,3,3,0,0,True,paraphrase_detection
"untuk membuat kondilus, dr mao dan kolega adel alhadlaq menggunakan sel induk dewasa yang diambil dari sumsum tulang tikus.",dia dan seorang kolega menciptakan kondilus artikular menggunakan sel induk yang diambil dari sumsum tulang tikus.,creative,0.52,"{'quality_score': 100, 'issues': [], 'word_count': 19, 'unique_word_ratio': 1.0}","{'quality_score': 100, 'issues': [], 'word_count': 16, 'unique_word_ratio': 1.0}",31,23,3,2,0,1,True,paraphrase_detection
"bagian senat dari ruu medicare hampir pasti, mungkin sedini hari ini.",bagian senat dari ruu medicare hampir pasti senin.,creative,0.5714285714285714,"{'quality_score': 100, 'issues': [], 'word_count': 11, 'unique_word_ratio': 1.0}","{'quality_score': 100, 'issues': [], 'word_count': 8, 'unique_word_ratio': 1.0}",17,13,1,1,0,0,True,paraphrase_detection
"pada usia 12, lionel tate didakwa dengan pembunuhan tingkat pertama atas kematian tiffany eunick.","tate berusia 12 tahun ketika dia didakwa mengalahkan tiffany eunick, 6, sampai mati pada juli 1999.",creative,0.3076923076923077,"{'quality_score': 100, 'issues': [], 'word_count': 14, 'unique_word_ratio': 1.0}","{'quality_score': 100, 'issues': [], 'word_count': 16, 'unique_word_ratio': 1.0}",23,25,4,3,1,0,True,paraphrase_detection
maskapai ini mengatakan hasilnya menunjukkan bahwa program pemulihannya dan inisiatif lain membantu mengimbangi kerusakan pendapatan yang berkelanjutan.,dikatakan hasil hari ini menunjukkan bahwa program dan langkah -langkah lain membantu mengimbangi kerusakan pendapatan yang berkelanjutan.,creative,0.5652173913043478,"{'quality_score': 100, 'issues': [], 'word_count': 17, 'unique_word_ratio': 1.0}","{'quality_score': 100, 'issues': [], 'word_count': 17, 'unique_word_ratio': 1.0}",20,20,4,2,0,2,True,paraphrase_detection
beratnya rata -rata 220 pound (100 kg) dan perlu kehilangan antara 30 dan 80 pound.,beratnya rata -rata 100 kilogram dan perlu kehilangan antara 14 dan 36 kilogram.,creative,0.47368421052631576,"{'quality_score': 100, 'issues': [], 'word_count': 15, 'unique_word_ratio': 0.9333333333333333}","{'quality_score': 100, 'issues': [], 'word_count': 13, 'unique_word_ratio': 0.9230769230769231}",21,16,4,3,0,1,True,paraphrase_detection
"saham oracle juga lebih tinggi, diperdagangkan naik 12 sen pada 13,60.","saham oracle rose rose rose 14 sen redwood menjadi 13,62.",creative,0.3157894736842105,"{'quality_score': 100, 'issues': [], 'word_count': 11, 'unique_word_ratio': 1.0}","{'quality_score': 100, 'issues': [], 'word_count': 10, 'unique_word_ratio': 0.8}",18,20,3,3,0,0,True,paraphrase_detection
"responden yang menilai kondisi bisnis saat ini sebagai ""buruk"" meningkat menjadi 30,4 dari 28,1 pada bulan juni.","""peringkat tersebut menyajikan kondisi bisnis sebagai buruk meningkat menjadi 30,4 persen dari 28,1 persen,"" kata laporan itu.",creative,0.4827586206896552,"{'quality_score': 100, 'issues': [], 'word_count': 17, 'unique_word_ratio': 1.0}","{'quality_score': 100, 'issues': [], 'word_count': 17, 'unique_word_ratio': 1.0}",26,27,6,2,1,3,True,paraphrase_detection
"mr. dewhurst telah menyerukan ""periode pendinginan"" antara sesi khusus, yang dapat memberi demokrat waktu di rumah.","dewhurst telah menyarankan periode pendinginan, yang bisa memberi para senator waktu untuk pulang.",creative,0.36,"{'quality_score': 100, 'issues': [], 'word_count': 16, 'unique_word_ratio': 1.0}","{'quality_score': 100, 'issues': [], 'word_count': 13, 'unique_word_ratio': 1.0}",26,18,6,4,0,2,True,paraphrase_detection
"wyeth memperkirakan bahwa 1,2 juta wanita terus minum pil prempro, turun dari sekitar 3,4 juta sebelum penelitian dihentikan musim panas lalu.","wyeth memperkirakan bahwa 1,2 juta wanita masih mengambil pil prempro, turun dari sekitar 3,4 juta sebelum studi whi dihentikan tahun lalu.",balanced,0.6551724137931034,"{'quality_score': 100, 'issues': [], 'word_count': 21, 'unique_word_ratio': 0.9523809523809523}","{'quality_score': 100, 'issues': [], 'word_count': 21, 'unique_word_ratio': 0.9523809523809523}",29,30,3,3,0,0,True,paraphrase_detection
"microsoft mengatakan pada hari jumat bahwa mereka menghentikan pengembangan versi macintosh di masa depan dari browser internet explorer, mengutip persaingan dari browser safari apple computer.","microsoft akan berhenti mengembangkan versi perangkat lunak browser internet explorer untuk komputer macintosh, mengatakan bahwa apple s safari sekarang adalah semua yang dibutuhkan apple.",creative,0.3157894736842105,"{'quality_score': 100, 'issues': [], 'word_count': 25, 'unique_word_ratio': 0.92}","{'quality_score': 100, 'issues': [], 'word_count': 24, 'unique_word_ratio': 1.0}",41,39,6,3,2,1,True,paraphrase_detection
kami saat ini berusaha memahami ruang lingkup dan rincian penyelidikan. . . .,weber mengatakan kamis malam bahwa perusahaan masih berusaha memahami ruang lingkup dan rincian penyelidikan.,creative,0.4444444444444444,"{'quality_score': 100, 'issues': [], 'word_count': 13, 'unique_word_ratio': 0.8461538461538461}","{'quality_score': 100, 'issues': [], 'word_count': 14, 'unique_word_ratio': 1.0}",18,18,2,1,0,1,True,paraphrase_detection
kepala eksekutif rod eddington akan bertemu dengan tiga serikat pekerja secara terpisah pada senin sore.,eddington akan bertemu dengan dua serikat lainnya secara terpisah pada hari senin.,creative,0.5263157894736842,"{'quality_score': 100, 'issues': [], 'word_count': 15, 'unique_word_ratio': 1.0}","{'quality_score': 100, 'issues': [], 'word_count': 12, 'unique_word_ratio': 1.0}",21,17,5,2,1,2,True,paraphrase_detection
"pendapatan operasi turun 4,5 persen menjadi 2,3 miliar dari tahun sebelumnya.","pendapatan operasi turun sekitar 1 persen menjadi 4,55 miliar, dari 4,59 miliar.",creative,0.5263157894736842,"{'quality_score': 100, 'issues': [], 'word_count': 11, 'unique_word_ratio': 1.0}","{'quality_score': 100, 'issues': [], 'word_count': 12, 'unique_word_ratio': 1.0}",14,17,4,2,1,1,True,paraphrase_detection
"""hukuman itu mencerminkan keseriusan yang dengannya kantor kami dan pengadilan memandang kejahatan ini,"" kata spitzer dalam sebuah pernyataan.","spitzer mengatakan dalam sebuah pernyataan bahwa hukuman itu ""mencerminkan keseriusan yang dengannya kantor kami dan pengadilan memandang kejahatan ini.""",safe,0.8260869565217391,"{'quality_score': 100, 'issues': [], 'word_count': 18, 'unique_word_ratio': 1.0}","{'quality_score': 100, 'issues': [], 'word_count': 19, 'unique_word_ratio': 1.0}",28,30,4,2,1,1,True,paraphrase_detection
"pemungutan suara datang hanya dua hari setelah kurdi menyapu pemilihan dewan kota, mengambil satu blok suara terbesar di dewan 30 kursi.",pemungutan suara untuk walikota mengikuti pemilihan dewan kota yang memberi kurdi blok suara terbesar di dewan 30 kursi.,creative,0.46153846153846156,"{'quality_score': 100, 'issues': [], 'word_count': 21, 'unique_word_ratio': 0.9047619047619048}","{'quality_score': 100, 'issues': [], 'word_count': 18, 'unique_word_ratio': 0.8888888888888888}",26,23,2,2,0,0,True,paraphrase_detection
"seorang mantan kandidat untuk gubernur new york, ia menata dirinya seorang penganjur pemerintahan perusahaan yang lebih baik.","mr. mccall, yang berlari tidak berhasil untuk gubernur new york pada tahun 2002, menata dirinya seorang penganjur pemerintahan perusahaan yang lebih baik.",creative,0.5769230769230769,"{'quality_score': 100, 'issues': [], 'word_count': 17, 'unique_word_ratio': 0.9411764705882353}","{'quality_score': 100, 'issues': [], 'word_count': 22, 'unique_word_ratio': 0.9545454545454546}",24,33,3,1,1,1,True,paraphrase_detection
"""kami akan terus berjuang dalam hukum . melawan kelompok teroris ini dan mereka yang mendukungnya.""","kami akan terus berjuang, dalam hukum, melawan band teroris. """,creative,0.5555555555555556,"{'quality_score': 100, 'issues': [], 'word_count': 15, 'unique_word_ratio': 1.0}","{'quality_score': 100, 'issues': [], 'word_count': 10, 'unique_word_ratio': 1.0}",21,14,5,2,1,2,True,paraphrase_detection
"di bawah perjanjian tersebut, pemegang saham lendingtree akan menerima 0,6199 dari saham usai untuk setiap saham di lendingtree.","di bawah saham yang diusulkan untuk transaksi saham, pemegang saham lendingtree akan mendapatkan 0,6199 saham biasa usai untuk setiap saham dari saham biasa lendingtree.",balanced,0.6363636363636364,"{'quality_score': 100, 'issues': [], 'word_count': 18, 'unique_word_ratio': 0.8333333333333334}","{'quality_score': 100, 'issues': [], 'word_count': 24, 'unique_word_ratio': 0.75}",28,34,5,3,1,1,True,paraphrase_detection
"untuk kuartal pertama, hp menarik 2,94 miliar dan menangkap 27,9 persen dari pasar.","h-p berada di urutan kedua dengan hampir 3,32 miliar dalam penjualan dan 26 persen dari pendapatan pasar.",creative,0.21875,"{'quality_score': 100, 'issues': [], 'word_count': 13, 'unique_word_ratio': 1.0}","{'quality_score': 100, 'issues': [], 'word_count': 17, 'unique_word_ratio': 1.0}",19,23,5,3,2,0,True,paraphrase_detection
"keputusan itu juga bisa terbukti bermanfaat dalam ""perang melawan terorisme"".",keputusan hari selasa bisa terbukti bermanfaat bagi pemerintah dalam perang melawan terorisme.,creative,0.5625,"{'quality_score': 100, 'issues': [], 'word_count': 10, 'unique_word_ratio': 1.0}","{'quality_score': 100, 'issues': [], 'word_count': 12, 'unique_word_ratio': 1.0}",14,17,4,1,1,2,True,paraphrase_detection
"itu seharusnya menjadi standar - bukan berapa banyak orang yang mendaftar, ""katanya.","""itu seharusnya menjadi standar, bukan berapa banyak orang yang benar -benar mendaftar,"" mr. rule mengatakan kepada hakim.",balanced,0.6666666666666666,"{'quality_score': 100, 'issues': [], 'word_count': 12, 'unique_word_ratio': 1.0}","{'quality_score': 100, 'issues': [], 'word_count': 17, 'unique_word_ratio': 1.0}",17,27,5,2,3,0,True,paraphrase_detection
"beberapa jam kemudian, dpr memilih 256 hingga 170 untuk meloloskan undang-undang restorasi hutan sehat yang disponsori oleh rep. scott mcinnis, r-colo.","dpr memilih 256-170 pada hari selasa untuk menyetujui ruu yang disponsori oleh rep. scott mcinnis, r-colo.",creative,0.5333333333333333,"{'quality_score': 100, 'issues': [], 'word_count': 21, 'unique_word_ratio': 1.0}","{'quality_score': 100, 'issues': [], 'word_count': 16, 'unique_word_ratio': 1.0}",36,34,4,2,1,1,True,paraphrase_detection
dewan peoplesoft sekarang memiliki 10 hari kerja untuk mengevaluasi penawaran oracle dan membuat rekomendasi kepada pemegang sahamnya.,"namun demikian, peoplesoft harus meninjau penawaran tender oracle dan membuat rekomendasi kepada pemegang saham.",creative,0.36,"{'quality_score': 100, 'issues': [], 'word_count': 17, 'unique_word_ratio': 1.0}","{'quality_score': 100, 'issues': [], 'word_count': 14, 'unique_word_ratio': 1.0}",22,21,4,3,1,0,True,paraphrase_detection
"jika ekuitas ekstra untuk proyek tidak dapat ditemukan, direktur austmag harus meninggalkan proyek untuk menghindari perdagangan saat perusahaan bangkrut.","jika ekuitas ekstra untuk proyek tidak dapat ditemukan, direktur amc harus meninggalkannya untuk menghindari perdagangan sementara amc bangkrut.",balanced,0.6818181818181818,"{'quality_score': 100, 'issues': [], 'word_count': 19, 'unique_word_ratio': 0.8947368421052632}","{'quality_score': 100, 'issues': [], 'word_count': 18, 'unique_word_ratio': 0.8888888888888888}",26,26,3,3,0,0,True,paraphrase_detection
"dalam posisi itu, elias akan melapor kepada joe tucci, presiden dan ceo emc.","sebagai wakil presiden eksekutif new ventures, elias akan melapor kepada joe tucci, presiden dan kepala eksekutif emc.",creative,0.5238095238095238,"{'quality_score': 100, 'issues': [], 'word_count': 13, 'unique_word_ratio': 1.0}","{'quality_score': 100, 'issues': [], 'word_count': 17, 'unique_word_ratio': 0.8823529411764706}",22,26,2,2,0,0,True,paraphrase_detection
"kelompok ini akan dipimpin oleh pejabat departemen luar negeri john s. wolf, yang telah bertugas di australia, vietnam, yunani dan pakistan.","kelompok ini akan dipimpin oleh john s. wolf, asisten sekretaris negara yang telah bertugas di australia, vietnam, yunani dan pakistan.",balanced,0.7307692307692307,"{'quality_score': 100, 'issues': [], 'word_count': 21, 'unique_word_ratio': 1.0}","{'quality_score': 100, 'issues': [], 'word_count': 20, 'unique_word_ratio': 1.0}",37,36,2,0,1,1,True,paraphrase_detection
"mr martin mengatakan perusahaan ""sangat optimis mengenai beberapa peningkatan dalam tren penjualan dan kinerja operasi pada paruh kedua tahun 2003"".","kami sangat optimis mengenai beberapa peningkatan tren kinerja penjualan dan operasi pada paruh kedua tahun 2003. """,balanced,0.7391304347826086,"{'quality_score': 100, 'issues': [], 'word_count': 20, 'unique_word_ratio': 1.0}","{'quality_score': 100, 'issues': [], 'word_count': 17, 'unique_word_ratio': 1.0}",26,19,6,1,2,3,True,paraphrase_detection
"para delegasi mengatakan mengumpulkan dan mendistribusikan dana telah dipersulit oleh penumpasan as tentang yayasan amal jihad, rekening bank organisasi terkait teror dan transfer uang.","pasukan bin laden menunjukkan bahwa mengumpulkan dan mendistribusikan dana telah dipersulit oleh penumpasan as tentang yayasan amal jihad, rekening bank organisasi terkait teror dan transfer uang.",balanced,0.7333333333333333,"{'quality_score': 100, 'issues': [], 'word_count': 24, 'unique_word_ratio': 0.9583333333333334}","{'quality_score': 100, 'issues': [], 'word_count': 26, 'unique_word_ratio': 0.9615384615384616}",31,34,1,1,0,0,True,paraphrase_detection
"""menghapus pengabaian tidak ada artinya ketika oracle masih memiliki litigasi yang tertunda di delaware yang menentang transaksi peoplesoft j.d. edwards,"" jawab peoplesoft.","dalam pernyataan publik, seorang juru bicara mengatakan: ""menghapus pengabaian tidak ada artinya ketika oracle masih menunggu litigasi di delaware yang menentang transaksi peoplesoft j.d. edwards.""",balanced,0.6363636363636364,"{'quality_score': 100, 'issues': [], 'word_count': 22, 'unique_word_ratio': 0.9545454545454546}","{'quality_score': 100, 'issues': [], 'word_count': 25, 'unique_word_ratio': 1.0}",46,49,5,2,1,2,True,paraphrase_detection
"penyanyi itu telah berada di ventilator sejak kecelakaan di perkebunannya di buckinghamshire tadi malam, tetapi kondisinya digambarkan sebagai ""stabil"" dan ""nyaman"".","penyanyi itu telah berada di ventilator sejak kecelakaan di perkebunannya di buckinghamshire pada hari senin, dengan kondisinya tadi malam digambarkan sebagai ""stabil dan nyaman"".",safe,0.8076923076923077,"{'quality_score': 100, 'issues': [], 'word_count': 21, 'unique_word_ratio': 0.9047619047619048}","{'quality_score': 100, 'issues': [], 'word_count': 24, 'unique_word_ratio': 0.9166666666666666}",36,37,4,0,1,3,True,paraphrase_detection
"format tersebut harus merupakan standar terbuka yang telah diratifikasi secara resmi oleh organisasi standar yang diakui secara internasional, dan ip harus dilisensikan dengan persyaratan yang wajar dan tidak diskriminatif.","format harus diratifikasi secara formal oleh organisasi standar yang diakui secara internasional, dan ip harus dilisensikan dengan persyaratan yang wajar dan tidak diskriminatif, tambah mereka.",balanced,0.7142857142857143,"{'quality_score': 100, 'issues': [], 'word_count': 29, 'unique_word_ratio': 0.7931034482758621}","{'quality_score': 100, 'issues': [], 'word_count': 25, 'unique_word_ratio': 0.84}",38,35,4,1,1,2,True,paraphrase_detection
"sementara ibrahims memiliki satu operasi pemisahan, goodrich dan dr. david staffenberg merencanakan sekitar tiga untuk aguirres, dengan beberapa minggu di antara masing -masing.","alih -alih satu operasi panjang untuk memisahkan si kembar, goodrich dan dr. david staffenberg merencanakan sekitar tiga, dengan masing -masing beberapa minggu.",creative,0.6,"{'quality_score': 100, 'issues': [], 'word_count': 23, 'unique_word_ratio': 1.0}","{'quality_score': 100, 'issues': [], 'word_count': 22, 'unique_word_ratio': 1.0}",39,33,5,2,1,2,True,paraphrase_detection
"kami bertindak karena kami melihat bukti yang ada dalam cahaya baru, melalui prisma pengalaman kami pada 11 september, ""kata rumsfeld.","sebaliknya, as bertindak karena administrasi melihat ""bukti yang ada dalam cahaya baru, melalui prisma pengalaman kami pada 11 september"".",balanced,0.7916666666666666,"{'quality_score': 100, 'issues': [], 'word_count': 20, 'unique_word_ratio': 0.9}","{'quality_score': 100, 'issues': [], 'word_count': 19, 'unique_word_ratio': 1.0}",28,25,5,2,1,2,True,paraphrase_detection
"tetapi indeks russell 2000, barometer saham perusahaan yang lebih kecil, memiliki keuntungan mingguan 3,71, atau 0,9 persen, ditutup pada 418,40.","tetapi russell 2000, barometer saham perusahaan kecil, memiliki keuntungan mingguan 3,71, atau 0,9 persen, ditutup pada 418,40.",safe,0.88,"{'quality_score': 100, 'issues': [], 'word_count': 20, 'unique_word_ratio': 1.0}","{'quality_score': 100, 'issues': [], 'word_count': 17, 'unique_word_ratio': 1.0}",34,31,2,0,0,2,True,paraphrase_detection
