original_text,paraphrase_text,category,similarity_score,original_quality,paraphrase_quality,original_token_count,paraphrase_token_count,word_changes_count,substitutions_count,additions_count,deletions_count,is_valid,source
"saham cellgy turun 2,04, atau 39 , menjadi 3,18 dalam perdagangan tengah hari di pasar saham nasdaq.","saham cellege anjlok 1,99 menjadi 3,23 senin di pasar saham nasdaq.",creative,0.32,"{'quality_score': 100, 'issues': [], 'word_count': 17, 'unique_word_ratio': 0.9411764705882353}","{'quality_score': 100, 'issues': [], 'word_count': 11, 'unique_word_ratio': 0.9090909090909091}",29,22,3,3,0,0,True,paraphrase_detection
"paul themba nyathi, juru bicara mdc, mengatakan klinik avenues menjadi sasaran karena merawat pendukung oposisi.",juru bicara mdc paul themba nyathi mengatakan klinik avenues menjadi sasaran karena menangani pendukung oposisi.,safe,0.8333333333333334,"{'quality_score': 100, 'issues': [], 'word_count': 15, 'unique_word_ratio': 1.0}","{'quality_score': 100, 'issues': [], 'word_count': 15, 'unique_word_ratio': 1.0}",29,27,3,1,1,1,True,paraphrase_detection
terengah -engah dapat didengar di ruang sidang saat foto ditampilkan.,terengah -engah dapat didengar karena foto itu diproyeksikan ke layar.,creative,0.4117647058823529,"{'quality_score': 100, 'issues': [], 'word_count': 10, 'unique_word_ratio': 1.0}","{'quality_score': 100, 'issues': [], 'word_count': 10, 'unique_word_ratio': 1.0}",14,14,2,2,0,0,True,paraphrase_detection
"""undang -undang memiliki beberapa kelemahan yang dapat dieksploitasi oleh teroris, merusak pertahanan kami,"" kata ashcroft.","dia mengakui bahwa hukum ""memiliki beberapa kelemahan yang dapat dieksploitasi oleh teroris, merusak pertahanan kita.""",creative,0.5652173913043478,"{'quality_score': 100, 'issues': [], 'word_count': 15, 'unique_word_ratio': 1.0}","{'quality_score': 100, 'issues': [], 'word_count': 15, 'unique_word_ratio': 1.0}",23,21,4,1,1,2,True,paraphrase_detection
"""anda tahu saya selalu berusaha jujur dengan anda dan terbuka tentang hidup saya,"" kata limbaugh pada hari jumat di programnya.","""anda tahu saya selalu berusaha jujur dengan anda dan terbuka tentang hidup saya,"" kata limbaugh saat pengakuan yang menakjubkan ditayangkan secara nasional.",creative,0.5714285714285714,"{'quality_score': 100, 'issues': [], 'word_count': 20, 'unique_word_ratio': 1.0}","{'quality_score': 100, 'issues': [], 'word_count': 22, 'unique_word_ratio': 1.0}",30,30,1,1,0,0,True,paraphrase_detection
"penyakit sars, perang di irak dan afghanistan, dan ketidakpastian ekonomi di eropa dan as telah mengalami perjalanan udara.","wabah sindrom pernapasan akut yang parah, perang di irak dan afghanistan dan ketidakpastian ekonomi di eropa dan amerika telah mengalami perjalanan udara.",creative,0.5833333333333334,"{'quality_score': 100, 'issues': [], 'word_count': 18, 'unique_word_ratio': 0.8333333333333334}","{'quality_score': 100, 'issues': [], 'word_count': 22, 'unique_word_ratio': 0.8636363636363636}",26,28,3,2,0,1,True,paraphrase_detection
bush mengatakan dia mengambil tindakan itu sebagai tanggapan atas klaim hamas atas tanggung jawab atas pemboman bus di israel pada hari selasa yang menewaskan 20 orang.,"bush mengatakan dalam sebuah pernyataan bahwa ia memerintahkan departemen keuangan as untuk bertindak setelah serangan bom bunuh diri selasa di yerusalem, yang menewaskan 20 orang.",creative,0.20930232558139536,"{'quality_score': 100, 'issues': [], 'word_count': 26, 'unique_word_ratio': 0.9230769230769231}","{'quality_score': 100, 'issues': [], 'word_count': 25, 'unique_word_ratio': 1.0}",37,36,2,2,0,0,True,paraphrase_detection
wwf juga berpikir 13.000 hewan lebih lanjut ditangkap setiap tahun di sekitar selat gibraltar dan di daerah terdekat.,"menurut wwf, 13.000 orang lebih lanjut diperkirakan ditangkap di sekitar selat gibraltar dan di zona tetangga.",creative,0.48,"{'quality_score': 100, 'issues': [], 'word_count': 18, 'unique_word_ratio': 0.9444444444444444}","{'quality_score': 100, 'issues': [], 'word_count': 16, 'unique_word_ratio': 0.9375}",28,27,6,3,2,1,True,paraphrase_detection
gubernur missouri bob holden meminta gedung putih untuk menyatakan bencana federal di 39 negara.,gubernur bob holden meminta bush untuk menyatakan 39 daerah bencana missouri.,creative,0.5882352941176471,"{'quality_score': 100, 'issues': [], 'word_count': 14, 'unique_word_ratio': 1.0}","{'quality_score': 100, 'issues': [], 'word_count': 11, 'unique_word_ratio': 1.0}",21,19,4,2,1,1,True,paraphrase_detection
"toll, perusahaan transportasi terbesar kedua di australia, minggu lalu menawarkan nz75 saham untuk tranz rail.","toll minggu lalu menawarkan untuk membeli perusahaan untuk saham nz75c, atau nz158 juta.",creative,0.4090909090909091,"{'quality_score': 100, 'issues': [], 'word_count': 15, 'unique_word_ratio': 1.0}","{'quality_score': 100, 'issues': [], 'word_count': 13, 'unique_word_ratio': 0.9230769230769231}",28,22,3,2,0,1,True,paraphrase_detection
"mereka pergi ke operasi kehendak bebas mereka sendiri, ""kata ayah mereka dadollah bijani.","mereka pergi ke operasi atas kehendak bebas mereka sendiri, reuters mengutip ayah mereka, tuan dadollah bijani, mengatakan.",balanced,0.631578947368421,"{'quality_score': 100, 'issues': [], 'word_count': 13, 'unique_word_ratio': 0.8461538461538461}","{'quality_score': 100, 'issues': [], 'word_count': 17, 'unique_word_ratio': 0.9411764705882353}",20,27,4,1,3,0,True,paraphrase_detection
"dalam perdagangan sore di eropa, cac-40 prancis naik 1,5 persen, ftse 100 inggris naik 0,3 persen dan indeks dax jerman naik 1,2 persen.","dalam perdagangan sore di eropa, cac-40 prancis maju dan ftse 100 inggris masing-masing naik 0,7 persen, sementara indeks dax jerman naik 0,6 persen.",balanced,0.7,"{'quality_score': 100, 'issues': [], 'word_count': 23, 'unique_word_ratio': 0.9130434782608695}","{'quality_score': 100, 'issues': [], 'word_count': 23, 'unique_word_ratio': 0.9565217391304348}",32,35,6,5,1,0,True,paraphrase_detection
dia didakwa dalam tiga pemboman di atlanta _ termasuk ledakan di olimpiade 1996 _ bersama dengan pemboman di alabama.,dia didakwa dalam tiga pemboman di atlanta termasuk ledakan di olimpiade 1996 dan satu di alabama.,balanced,0.7222222222222222,"{'quality_score': 100, 'issues': [], 'word_count': 19, 'unique_word_ratio': 0.7894736842105263}","{'quality_score': 100, 'issues': [], 'word_count': 16, 'unique_word_ratio': 0.875}",29,25,2,1,0,1,True,paraphrase_detection
undang -undang baru mewajibkan perpustakaan dan sekolah untuk menggunakan filter atau kehilangan pembiayaan federal.,putusan 6-3 mengembalikan undang-undang yang mengatakan kepada perpustakaan untuk memasang filter atau menyerahkan uang federal.,creative,0.32,"{'quality_score': 100, 'issues': [], 'word_count': 14, 'unique_word_ratio': 1.0}","{'quality_score': 100, 'issues': [], 'word_count': 15, 'unique_word_ratio': 1.0}",17,20,5,3,1,1,True,paraphrase_detection
peterson telah didakwa dengan dua tuduhan pembunuhan dalam kematian istri dan putranya.,"peterson, 31, sekarang didakwa melakukan pembunuhan dalam kematian istrinya yang berusia 27 tahun dan putra mereka yang belum lahir.",creative,0.2692307692307692,"{'quality_score': 100, 'issues': [], 'word_count': 12, 'unique_word_ratio': 1.0}","{'quality_score': 100, 'issues': [], 'word_count': 19, 'unique_word_ratio': 0.9473684210526315}",16,25,4,4,0,0,True,paraphrase_detection
"""kami tidak ada hubungannya dengan keputusan personel internal saham,"" kata juru bicara microsoft sean sundwell.","""microsoft sama sekali tidak ada hubungannya dengan keputusan personel internal atstake,"" kata sundwall.",creative,0.5454545454545454,"{'quality_score': 100, 'issues': [], 'word_count': 15, 'unique_word_ratio': 1.0}","{'quality_score': 100, 'issues': [], 'word_count': 13, 'unique_word_ratio': 1.0}",24,24,3,3,0,0,True,paraphrase_detection
"""produk biotek, jika ada, mungkin lebih aman daripada produk konvensional karena semua pengujian,"" kata fraley.","""produk biotek, jika ada, mungkin lebih aman daripada produk konvensional karena semua pengujian,"" kata robert fraley, wakil presiden eksekutif monsanto.",balanced,0.7727272727272727,"{'quality_score': 100, 'issues': [], 'word_count': 15, 'unique_word_ratio': 1.0}","{'quality_score': 100, 'issues': [], 'word_count': 20, 'unique_word_ratio': 1.0}",25,34,2,0,2,0,True,paraphrase_detection
sco juga menuduh bahwa kernel linux generik berisi kode yang berasal dari properti unix -nya.,sco mengklaim bahwa kernel linux memegang kekayaan intelektual unix yang dimiliki oleh sco.,creative,0.30434782608695654,"{'quality_score': 100, 'issues': [], 'word_count': 15, 'unique_word_ratio': 1.0}","{'quality_score': 100, 'issues': [], 'word_count': 13, 'unique_word_ratio': 1.0}",22,20,3,3,0,0,True,paraphrase_detection
"dia mengatakan mereka seharusnya ""tidak benar -benar berpatroli atau berada di sekitar daerah -daerah itu ketika mereka . sedang melakukan doa mereka.""","dia mengatakan mereka seharusnya ""tidak benar -benar berpatroli atau berada di sekitar daerah -daerah itu ketika mereka berada di saat mereka ketika mereka melakukan doa -doa mereka.""",safe,0.9047619047619048,"{'quality_score': 100, 'issues': [], 'word_count': 22, 'unique_word_ratio': 0.9545454545454546}","{'quality_score': 100, 'issues': [], 'word_count': 27, 'unique_word_ratio': 0.7777777777777778}",30,36,2,1,1,0,True,paraphrase_detection
"pada hari rabu, ada 65 kemungkinan kasus sars di wilayah toronto.","pada hari senin, ada 66 kemungkinan kasus di dalam dan sekitar toronto, sebuah kota berpenduduk 4 juta orang.",creative,0.375,"{'quality_score': 100, 'issues': [], 'word_count': 11, 'unique_word_ratio': 1.0}","{'quality_score': 100, 'issues': [], 'word_count': 18, 'unique_word_ratio': 1.0}",17,25,5,3,1,1,True,paraphrase_detection
dia juga bekerja di kantor jaksa agung virginia.,"sebelum itu ia memegang berbagai pos di virginia, termasuk wakil jaksa agung.",creative,0.2777777777777778,"{'quality_score': 100, 'issues': [], 'word_count': 8, 'unique_word_ratio': 1.0}","{'quality_score': 100, 'issues': [], 'word_count': 12, 'unique_word_ratio': 1.0}",14,18,3,2,0,1,True,paraphrase_detection
"gugatan itu akan diajukan terhadap sekretaris negara kevin shelley dan pejabat pemilihan di los angeles, orange dan san diego counties.","gugatan itu menamakan shelley, seorang demokrat, dan pendaftar di los angeles, orange dan san diego counties.",creative,0.52,"{'quality_score': 100, 'issues': [], 'word_count': 20, 'unique_word_ratio': 0.95}","{'quality_score': 100, 'issues': [], 'word_count': 16, 'unique_word_ratio': 0.9375}",33,31,3,2,1,0,True,paraphrase_detection
setengah dari wanita diberi dosis harian obat dan setengah mengambil plasebo.,setengah dari wanita menerima tablet harian dari kombinasi estrogen plus progestin sementara sisanya diberi plasebo.,creative,0.3684210526315789,"{'quality_score': 100, 'issues': [], 'word_count': 11, 'unique_word_ratio': 0.9090909090909091}","{'quality_score': 100, 'issues': [], 'word_count': 15, 'unique_word_ratio': 0.9333333333333333}",15,21,2,0,1,1,True,paraphrase_detection
"peringatan tahap satu dinyatakan ketika pembacaan ozon melebihi 0,20 bagian per juta selama periode satu jam.","episode tahap 1 dinyatakan ketika tingkat ozon mencapai 0,20 bagian per juta.",creative,0.5,"{'quality_score': 100, 'issues': [], 'word_count': 16, 'unique_word_ratio': 0.9375}","{'quality_score': 100, 'issues': [], 'word_count': 12, 'unique_word_ratio': 1.0}",19,15,5,4,0,1,True,paraphrase_detection
"saham smithfield menutup 1,64, atau 8,5 persen, dengan 20,85, di new york stock exchange.","saham smithfield naik 1,64 kemarin menjadi ditutup pada 20,85, kenaikan 8,5 persen, di new york stock exchange.",balanced,0.64,"{'quality_score': 100, 'issues': [], 'word_count': 14, 'unique_word_ratio': 1.0}","{'quality_score': 100, 'issues': [], 'word_count': 17, 'unique_word_ratio': 1.0}",31,34,4,2,1,1,True,paraphrase_detection
dia mentransfer 10 juta saham lagi ke kepercayaan amal dan saham ini juga dilikuidasi.,"10 juta saham lebih lanjut ditransfer ke kepercayaan amal, setelah itu mereka juga dijual.",creative,0.36363636363636365,"{'quality_score': 100, 'issues': [], 'word_count': 14, 'unique_word_ratio': 0.9285714285714286}","{'quality_score': 100, 'issues': [], 'word_count': 14, 'unique_word_ratio': 1.0}",20,17,4,3,0,1,True,paraphrase_detection
"obat eksperimental dapat memperlambat hilangnya penglihatan yang disebabkan oleh penyakit mata yang merupakan penyebab utama kebutaan di antara orang tua, para peneliti telah menemukan.","obat eksperimental dapat memperlambat hilangnya penglihatan yang disebabkan oleh penyakit mata yang menjengkelkan yang merupakan penyebab utama kebutaan di antara orang tua, dokter melaporkan pada hari sabtu.",balanced,0.6774193548387096,"{'quality_score': 100, 'issues': [], 'word_count': 24, 'unique_word_ratio': 0.9583333333333334}","{'quality_score': 100, 'issues': [], 'word_count': 27, 'unique_word_ratio': 0.9259259259259259}",27,35,2,1,1,0,True,paraphrase_detection
"""partai kami tidak akan pernah menjadi pilihan nra - dan saya tidak ingin menjadi kandidat nra,"" katanya.","partai kami tidak akan pernah menjadi pilihan n.r.a., dan saya tidak ingin menjadi kandidat n.r.a., ""referensi ke national rifle association.",creative,0.56,"{'quality_score': 100, 'issues': [], 'word_count': 17, 'unique_word_ratio': 0.8823529411764706}","{'quality_score': 100, 'issues': [], 'word_count': 20, 'unique_word_ratio': 0.85}",24,41,4,3,0,1,True,paraphrase_detection
"para ahli mengatakan mereka berpikir pengobatan yang lebih baik, termasuk penggunaan tamoxifen obat secara luas, serta skrining mammogram bertanggung jawab atas peningkatan tersebut.","para ahli mengatakan mereka berpikir pengobatan yang lebih baik, termasuk penggunaan tamoxifen obat dan skrining mammogram, bertanggung jawab.",balanced,0.7307692307692307,"{'quality_score': 100, 'issues': [], 'word_count': 23, 'unique_word_ratio': 1.0}","{'quality_score': 100, 'issues': [], 'word_count': 18, 'unique_word_ratio': 1.0}",34,29,3,1,1,1,True,paraphrase_detection
"""sungguh menakjubkan menjadi bagian dari industri yang memberi penghargaan pada anak -anaknya,"" kata hernandez, yang merupakan lulusan baru dari parsons school of design.","""sungguh menakjubkan menjadi bagian dari industri yang memberi penghargaan pada anak -anaknya,"" kata hernandez, yang hanya lulus dari parsons school of design mei lalu.",balanced,0.7586206896551724,"{'quality_score': 100, 'issues': [], 'word_count': 23, 'unique_word_ratio': 0.9130434782608695}","{'quality_score': 100, 'issues': [], 'word_count': 24, 'unique_word_ratio': 0.9166666666666666}",35,37,2,1,1,0,True,paraphrase_detection
"robert stewart, juru bicara park place, perusahaan induk caesars palace, mengatakan dia terkejut dengan keputusan pengadilan.","robert stewart, juru bicara park place entertainment, perusahaan induk untuk caesars, mengatakan mahkamah agung tampaknya mengubah aturan untuk tuntutan hukum.",creative,0.4444444444444444,"{'quality_score': 100, 'issues': [], 'word_count': 16, 'unique_word_ratio': 1.0}","{'quality_score': 100, 'issues': [], 'word_count': 20, 'unique_word_ratio': 0.95}",30,32,4,1,2,1,True,paraphrase_detection
"produk terkait pc adalah sektor terkuat di bulan juli, dengan mikroprosesor naik 5,6 dan dram naik 8,2 dari juni, kata kelompok industri itu.","produk terkait pc adalah penjual terkuat, dengan mikroprosesor naik 5,6 persen dan dram naik 8,2 persen, kata sia.",creative,0.5862068965517241,"{'quality_score': 100, 'issues': [], 'word_count': 23, 'unique_word_ratio': 0.9565217391304348}","{'quality_score': 100, 'issues': [], 'word_count': 18, 'unique_word_ratio': 0.9444444444444444}",32,28,5,3,1,1,True,paraphrase_detection
"kelompok yang mengkritik schwarzenegger, liga warga amerika latin, mengatakan posisi dewan penasihat aktor kelahiran austria itu mempertanyakan komitmennya kepada orang latin.","league of united latin american citizens, kelompok yang mengkritik schwarzenegger, mengatakan posisi dewan penasihat aktor kelahiran austria itu mempertanyakan komitmennya kepada hispanik.",balanced,0.6428571428571429,"{'quality_score': 100, 'issues': [], 'word_count': 21, 'unique_word_ratio': 1.0}","{'quality_score': 100, 'issues': [], 'word_count': 22, 'unique_word_ratio': 1.0}",31,41,3,1,1,1,True,paraphrase_detection
"di kanada, dolar booming akan menjadi fokus lagi karena mencoba untuk tetap di atas tanda 75 sen (a.s.).","di kanada, dolar yang melonjak menjadi fokus lagi karena berjuang dan gagal untuk tetap di atas tanda 75 sen (a.s.).",balanced,0.7037037037037037,"{'quality_score': 100, 'issues': [], 'word_count': 18, 'unique_word_ratio': 0.9444444444444444}","{'quality_score': 100, 'issues': [], 'word_count': 20, 'unique_word_ratio': 0.95}",31,31,2,2,0,0,True,paraphrase_detection
"tawaran 19,50 per saham, datang dua hari setelah peoplesoft merevisi tawarannya untuk saingan kecil j.d. edwards co. jdec.o untuk memasukkan uang tunai serta saham.","tawaran oracle 19,50 per saham datang dua hari setelah peoplesoft menambahkan uang tunai ke kesepakatan all-share aslinya dengan saingan kecil j.d. edwards co. jdec.o.",balanced,0.6111111111111112,"{'quality_score': 100, 'issues': [], 'word_count': 24, 'unique_word_ratio': 0.9583333333333334}","{'quality_score': 100, 'issues': [], 'word_count': 24, 'unique_word_ratio': 1.0}",42,45,4,1,1,2,True,paraphrase_detection
"""divisi baru ini akan difokuskan pada tugas yang sangat penting untuk melindungi aset cyber bangsa sehingga kita dapat melindungi sebaiknya melindungi aset infrastruktur kritis negara.""","""divisi baru ini akan difokuskan pada tugas yang sangat penting untuk melindungi cyberasset negara sehingga kita dapat melindungi paling baik untuk melindungi aset infrastruktur kritis negara,"" tambahnya.",balanced,0.7241379310344828,"{'quality_score': 100, 'issues': [], 'word_count': 25, 'unique_word_ratio': 0.88}","{'quality_score': 100, 'issues': [], 'word_count': 27, 'unique_word_ratio': 0.8888888888888888}",29,36,4,2,1,1,True,paraphrase_detection
"mereka tidak disediakan atau diberikan kepada kami tetapi digali oleh reporter kami, david blair, di kementerian luar negeri di baghdad. ""","mereka tidak disediakan atau diberikan kepada kami, tetapi digali oleh reporter kami ""dalam kementerian luar negeri irak, katanya.",balanced,0.7083333333333334,"{'quality_score': 100, 'issues': [], 'word_count': 21, 'unique_word_ratio': 0.9523809523809523}","{'quality_score': 100, 'issues': [], 'word_count': 18, 'unique_word_ratio': 1.0}",29,24,4,2,1,1,True,paraphrase_detection
jaksa menuduh bahwa nichols dan co-conspirator timothy mcveigh bekerja bersama untuk menyiapkan bom yang menghancurkan gedung federal alfred p. murrah.,jaksa menuduh bahwa nichols dan coconspirator timothy mcveigh bekerja bersama untuk menyiapkan bom bahan bakar dan pengukur 4.000 pon yang menghancurkan gedung murrah.,creative,0.5666666666666667,"{'quality_score': 100, 'issues': [], 'word_count': 20, 'unique_word_ratio': 1.0}","{'quality_score': 100, 'issues': [], 'word_count': 23, 'unique_word_ratio': 0.9565217391304348}",36,38,3,1,1,1,True,paraphrase_detection
"proposal tersebut kemungkinan akan menghasilkan pemilihan 22 partai republik dan 10 demokrat ke kongres, alih -alih 17 demokrat saat ini dan 15 partai republik, kata pejabat.","rencana tersebut kemungkinan akan menghasilkan pemilihan 22 republikan dan 10 demokrat dari texas, versus 17 demokrat saat ini dan 15 partai republik, kata pejabat.",balanced,0.6551724137931034,"{'quality_score': 100, 'issues': [], 'word_count': 26, 'unique_word_ratio': 0.8846153846153846}","{'quality_score': 100, 'issues': [], 'word_count': 24, 'unique_word_ratio': 0.9166666666666666}",33,35,4,4,0,0,True,paraphrase_detection
"jumlah nama host yang menggunakan bsd mendekati empat juta, sedangkan jumlah situs aktif hampir dua juta, kata netcraft.","jumlah nama host yang menggunakan bsd mendekati 4 juta, sedangkan jumlah situs aktif hampir 2 juta, kata netcraft.",balanced,0.8,"{'quality_score': 100, 'issues': [], 'word_count': 18, 'unique_word_ratio': 0.8888888888888888}","{'quality_score': 100, 'issues': [], 'word_count': 18, 'unique_word_ratio': 0.8888888888888888}",26,26,2,2,0,0,True,paraphrase_detection
produk pertama cenderung biaya dongle antara us 100 dan us 150 yang akan membangun koneksi antara perangkat elektronik konsumen dan pc.,produk pertama kemungkinan adalah dongle seharga 100 hingga 150 yang akan membuat koneksi antara perangkat elektronik konsumen dan pc.,balanced,0.625,"{'quality_score': 100, 'issues': [], 'word_count': 21, 'unique_word_ratio': 0.8571428571428571}","{'quality_score': 100, 'issues': [], 'word_count': 19, 'unique_word_ratio': 1.0}",28,24,4,4,0,0,True,paraphrase_detection
"setelah 9 11, kata connolly, agen menghabiskan ribuan jam untuk menyelidiki al-bayoumi.",connolly mengatakan agen fbi di san diego dan luar negeri menghabiskan ribuan jam untuk menyelidiki al-bayoumi.,creative,0.4583333333333333,"{'quality_score': 100, 'issues': [], 'word_count': 12, 'unique_word_ratio': 1.0}","{'quality_score': 100, 'issues': [], 'word_count': 16, 'unique_word_ratio': 1.0}",22,26,3,1,1,1,True,paraphrase_detection
"hakim agung john paul stevens membandingkan interogasi martinez dengan ""upaya untuk mendapatkan pengakuan yang tidak disengaja dari seorang tahanan dengan metode yang menyiksa.""","menulis untuk minoritas, hakim agung john paul stevens mengatakan interogasi itu mirip dengan ""upaya untuk mendapatkan pengakuan yang tidak disengaja dari seorang tahanan dengan metode yang menyiksa.""",balanced,0.7241379310344828,"{'quality_score': 100, 'issues': [], 'word_count': 23, 'unique_word_ratio': 0.9130434782608695}","{'quality_score': 100, 'issues': [], 'word_count': 27, 'unique_word_ratio': 0.8888888888888888}",35,38,3,2,1,0,True,paraphrase_detection
"salah satu karyawan perusahaan dirawat di rumah sakit dalam kondisi kritis di rumah sakit lee memorial di fort myers, kata asisten administrasi rumah sakit alex reichert.",salah satu karyawan yang selamat dari ledakan dan kebakaran dirawat di rumah sakit dalam kondisi kritis di fort myers.,creative,0.4642857142857143,"{'quality_score': 100, 'issues': [], 'word_count': 26, 'unique_word_ratio': 0.7692307692307693}","{'quality_score': 100, 'issues': [], 'word_count': 19, 'unique_word_ratio': 0.9473684210526315}",36,23,3,1,0,2,True,paraphrase_detection
"pengacara calvin hollins jr., thomas royce, telah berulang kali mengatakan kliennya tidak memiliki hubungan dengan perusahaan yang memiliki dan mengoperasikan e2.","pengacara untuk hollins jr., thomas royce, mengatakan kliennya tidak memiliki tautan ke perusahaan yang memiliki dan mengoperasikan e2.",balanced,0.64,"{'quality_score': 100, 'issues': [], 'word_count': 21, 'unique_word_ratio': 0.9523809523809523}","{'quality_score': 100, 'issues': [], 'word_count': 18, 'unique_word_ratio': 0.9444444444444444}",37,33,3,2,0,1,True,paraphrase_detection
tiga kapal perang amerika berada di luar pantai liberia yang membawa total 2.300 marinir.,ada tiga kapal perang dengan 2.300 marinir yang berlama -lama di lepas pantai.,creative,0.45454545454545453,"{'quality_score': 100, 'issues': [], 'word_count': 14, 'unique_word_ratio': 1.0}","{'quality_score': 100, 'issues': [], 'word_count': 13, 'unique_word_ratio': 1.0}",20,21,3,1,2,0,True,paraphrase_detection
survei yang menemukan itu hanya menutupi sepotong langit yang sempit.,survei yang mengungkap bintang hanya menutupi sepotong langit yang sempit.,balanced,0.6666666666666666,"{'quality_score': 100, 'issues': [], 'word_count': 10, 'unique_word_ratio': 0.9}","{'quality_score': 100, 'issues': [], 'word_count': 10, 'unique_word_ratio': 0.9}",12,12,1,1,0,0,True,paraphrase_detection
"dengan meluncur pengawasan fda, kata eagan, kualitas obat yang diimpor ""kurang dapat diprediksi"" daripada yang diperoleh di amerika serikat.","dengan meluncur pengawasan fda, eagan mengatakan kualitas obat yang diimpor ""kurang dapat diprediksi"" daripada obat -obatan a.s.",balanced,0.6153846153846154,"{'quality_score': 100, 'issues': [], 'word_count': 19, 'unique_word_ratio': 0.9473684210526315}","{'quality_score': 100, 'issues': [], 'word_count': 17, 'unique_word_ratio': 0.9411764705882353}",28,29,4,2,1,1,True,paraphrase_detection
"""perusahaan selalu membuat, dan terus membuat, layanan pelanggan yang luar biasa dan kepuasan pelanggan sebagai prioritas utama,"" kata pernyataan itu.","perusahaan selalu membuat, dan terus membuat, layanan pelanggan yang luar biasa dan kepuasan pelanggan sebagai prioritas utama dalam semua praktik bisnis, ""tambah aol.",balanced,0.6538461538461539,"{'quality_score': 100, 'issues': [], 'word_count': 20, 'unique_word_ratio': 0.85}","{'quality_score': 100, 'issues': [], 'word_count': 23, 'unique_word_ratio': 0.8695652173913043}",27,31,3,1,1,1,True,paraphrase_detection
tradisi balap hari buruh didirikan sejak lama di kekaisaran inland.,ada tradisi balapan hari buruh di inland valley.,creative,0.42857142857142855,"{'quality_score': 100, 'issues': [], 'word_count': 10, 'unique_word_ratio': 1.0}","{'quality_score': 100, 'issues': [], 'word_count': 8, 'unique_word_ratio': 1.0}",13,13,5,1,2,2,True,paraphrase_detection
"tapi dia menambahkan: ""anda tidak bisa memenangkan pemilihan dengan melihat di kaca spion.""","""anda tidak dapat memenangkan pemilihan dengan melihat melalui kaca spion,"" katanya.",creative,0.5,"{'quality_score': 100, 'issues': [], 'word_count': 13, 'unique_word_ratio': 1.0}","{'quality_score': 100, 'issues': [], 'word_count': 11, 'unique_word_ratio': 1.0}",20,17,5,2,1,2,True,paraphrase_detection
